{"artifactId":"calibration-artifact-complete-1","calibrationRunId":"calibration-run-complete-1","canonicalizationVersion":"rubrist-canonical-json/v1","contract":"rubrist/binary-calibration-private-ledger/v1","itemCount":2,"projectId":"project-fixture","records":[{"attemptState":"terminal","commitmentSalt":"1111111111111111111111111111111111111111111111111111111111111111","datasetRevisionItemDigest":"sha256:0101010101010101010101010101010101010101010101010101010101010101","errorCode":null,"physicalProviderCalls":2,"providerObservation":{"observedModel":"fixture-model","observedVersion":null,"provider":"fixture-provider","systemFingerprint":null},"terminalEvaluatorOutcome":"evaluator_pass","trialIndex":0,"truthLabel":"pass"},{"attemptState":"terminal","commitmentSalt":"2222222222222222222222222222222222222222222222222222222222222222","datasetRevisionItemDigest":"sha256:0202020202020202020202020202020202020202020202020202020202020202","errorCode":null,"physicalProviderCalls":1,"providerObservation":{"observedModel":"fixture-model","observedVersion":null,"provider":"fixture-provider","systemFingerprint":null},"terminalEvaluatorOutcome":"abstained","trialIndex":0,"truthLabel":"fail"}],"requestedProvider":"fixture-provider","revisionDigest":"sha256:4444444444444444444444444444444444444444444444444444444444444444","schemaVersion":1,"trialsPerItem":1}